?全国地方公共団体コード,ID,都道府県,市区町村名,名称,名称_カナ,設置目的,実施支援の主な区分,住所,方書,緯度,経度,電話番号1,電話番号1_連絡先備考,電話番号2,電話番号2_連絡先備考,内線番号,FAX番号,URL,メールアドレス1,メールアドレス1_連絡先備考,メールアドレス2,メールアドレス2_連絡先備考,法人番号,運営団体名,開催頻度,開催曜日,開催日,開催開始時間,開催終了時間,開催日時特記事項,参加条件,参加費_幼児,参加費_小学生,参加費_中学生,参加費_高校生,参加費_大人,参加費特記事項,予約方法,予約特記事項,定員,フードパントリー実施,テイクアウト実施,学区,ネットワークの加入,追加情報NO,画像,画像_ライセンス,備考
132071,1,東京都,昭島市,あきしまこどもクッキング,アキシマコドモクッキング,,,東京都昭島市つつじが丘3-7-7,公民館3階実習室,,,,,,,,,,,,,,,,5,水,,,,,,,,,,,,,,,,,,,,,,
132071,2,東京都,昭島市,たまりば☆ぬくぬく,タマリバヌクヌク,,,東京都昭島市松原町1-3-10,松原町コミュニティセンター,,,,,,,,,,,,,,,,5,水,,,,,,,,,,,,,,,,,,,,,,
132071,3,東京都,昭島市,あおぞらみんな食堂,アオゾラミンナショクドウ,,,東京都昭島市郷地町2-20-24,あおぞらみんなカフェ,,,,,,,,,,,,,,,,3,木,,,,,,,,,,,,,,,,,,,,,,
132071,4,東京都,昭島市,あのねの会あのね食堂,アノネノカイアノネショクドウ,,,東京都昭島市宮沢町512-13,昭文自治会館,,,,,,,,,,,,,,,,3,水日,,,,,,,,,,,,,,,,,,,,,,
132071,5,東京都,昭島市,子ども料理ひろば,コドモリョウリヒロバ,,,東京都昭島市玉川町5-13-13,西総ビル101 ひだまりルーム,,,,,,,,,,,,,,,,5,土,,,,,,,,,,,,,,,,,,,,,,
132071,6,東京都,昭島市,昭島子ども食堂みほりん広場,アキシマコドモショクドウミホリンヒロバ,,,東京都昭島市拝島町3926-11,堀向公会堂,,,,,,,,,,,,,,,,5,土,,,,,,,,,,,,,,,,,,,,,,
